{
  "taskId": "2026-05-18-pantheon-base-audit-and-qa",
  "repo": "pantheon-platform",
  "agent": {
    "tool": "codex",
    "adapter": ".agents/adapters/codex.md"
  },
  "commands": [
    {
      "command": "node scripts/frontmatter-check.mjs",
      "cwd": "pantheon-base",
      "status": "passed",
      "durationMs": 0,
      "notes": "doc governance gate"
    },
    {
      "command": "node --test tests/docs/frontmatter-check.test.mjs",
      "cwd": "pantheon-base",
      "status": "passed",
      "durationMs": 0,
      "notes": "doc governance tests"
    },
    {
      "command": "cd frontend && cmd /c npm run build",
      "cwd": "pantheon-base",
      "status": "passed",
      "durationMs": 0,
      "notes": "prebuild checks and production build"
    },
    {
      "command": "go test ./...",
      "cwd": "pantheon-base",
      "status": "passed",
      "durationMs": 0,
      "notes": "backend and package unit baseline"
    },
    {
      "command": "cd frontend && cmd /c npm run test:smoke:system:pages",
      "cwd": "pantheon-base",
      "status": "passed",
      "durationMs": 0,
      "notes": "68 system/workspace page smoke tests passed after role-name assertion alignment"
    },
    {
      "command": "cd frontend && cmd /c npm run test:smoke:system:auth",
      "cwd": "pantheon-base",
      "status": "passed",
      "durationMs": 0,
      "notes": "role authorization smoke passed"
    },
    {
      "command": "cd frontend && cmd /c npm run test:smoke:system:ui",
      "cwd": "pantheon-base",
      "status": "passed",
      "durationMs": 0,
      "notes": "backoffice visual acceptance and system form state matrix passed"
    },
    {
      "command": "cd frontend && cmd /c npm run test:smoke:system:api",
      "cwd": "pantheon-base",
      "status": "passed",
      "durationMs": 0,
      "notes": "11 api smoke tests passed"
    },
    {
      "command": "cd frontend && cmd /c npm run test:smoke:system:governance",
      "cwd": "pantheon-base",
      "status": "passed",
      "durationMs": 0,
      "notes": "12 governance smoke tests passed, 1 host-real flow skipped; outer wrapper later timed out during teardown/log flush"
    },
    {
      "command": "cd frontend && cmd /c npm run test:smoke:system:shell",
      "cwd": "pantheon-base",
      "status": "passed",
      "durationMs": 0,
      "notes": "shell smoke and dedicated shell visual contract passed; outer wrapper later timed out during teardown/log flush"
    },
    {
      "command": "cd frontend && cmd /c npx playwright test tests/smoke/platform/shell-visual-contract.spec.ts --config=playwright.config.ts --workers=1",
      "cwd": "pantheon-base",
      "status": "passed",
      "durationMs": 0,
      "notes": "13 shell visual contract assertions passed; outer wrapper later timed out during teardown/log flush"
    }
  ],
  "browserEvidence": [
    {
      "viewport": "desktop",
      "url": "/system/user",
      "visualGap": "no blocking visual gap in acceptance scope; residual dev-only ResizeObserver warning remains",
      "consoleErrors": [
        "ResizeObserver loop completed with undelivered notifications"
      ],
      "checkedStates": ["loading", "empty", "error", "permission"]
    }
  ],
  "linkage": {
    "taskPacket": "docs/harness/tasks/2026-05-18-pantheon-base-audit-and-qa.task.md",
    "evidenceDir": ".harness/evidence/2026-05-18-pantheon-base-audit-and-qa/",
    "reviewFile": ".harness/evidence/2026-05-18-pantheon-base-audit-and-qa/review.md",
    "changeRef": "none",
    "planRefs": []
  },
  "knownGaps": [
    "vite dev server still reports ResizeObserver loop notifications during smoke",
    "long-running Playwright commands can finish green but still hit outer command timeout during teardown/log flush",
    "module-governance-host-real remains skipped in this environment"
  ],
  "completedAt": "2026-05-19T03:20:00Z"
}
